{
  "schema_version": "1.0",
  "artifact_type": "teacher_work_plan_extraction",
  "extraction_id": "grade-7-science-teacher-work-plan-extraction",
  "source": {
    "repository_path": "project-files/inputs/originals/teacher-work-plans/Opetaja-tookava-Loodusopetus-7-klass.pdf",
    "original_filename": "Õpetaja-töökava_Loodusõpetus_7.-klass.pdf",
    "sha256": "fb883aaf6429af4b543def1eb18deca3909ec541b4eaa5eccc7efb880368f35f",
    "byte_size": 325726,
    "page_count": 17,
    "displayed_title": "ÕPETAJA TÖÖKAVA",
    "author": "Riina Murulaid",
    "grade": 7,
    "subject": "science",
    "subject_et": "loodusõpetus",
    "language": "et",
    "provenance_kind": "supplementary_teacher_work_plan",
    "canonical": false
  },
  "extraction": {
    "method": "embedded_text_plus_visual_page_verification",
    "embedded_text_used": true,
    "visual_verification": "all_pages_rendered_and_reviewed",
    "verified_pages": [
      1,
      2,
      3,
      4,
      5,
      6,
      7,
      8,
      9,
      10,
      11,
      12,
      13,
      14,
      15,
      16,
      17
    ],
    "ocr_used": false,
    "transformations": [
      "PDF-i sisseehitatud tekst eraldati tabelite kaupa ja pikad lahtrid normaliseeriti lühikesteks eestikeelseteks väljadeks.",
      "Lehekülgede vahel jätkuvad tabeliread ühendati kõigi 17 renderdatud lehekülje visuaalse kontrolli alusel.",
      "Kõik nähtavad tunninumbrid 1-70 säilitati 58 source-table range-kirjes ning numbrita kokkuvõtterida eraldi unnumbered_rows kirjes.",
      "PDF-i trükitud ja annotatsioonidena talletatud URL-id säilitati source-captured linkidena ilma nende praegust toimivust väitmata."
    ],
    "limitations": [
      "Allikas on õpetaja töökava näidis, mitte ametliku õppekava ammendav ega kohustuslik järjestus.",
      "Plokkide pealkirjad ei deklareeri tunnimahte; plokkide mahud tuletati üksnes nähtavatest nummerdatud tunnivahemikest.",
      "Kolmanda ploki eraldi trükitud pealkirja ei tuvastatud; nimetus LOODUSNÄHTUSED normaliseeriti tunni 35, õppesisu ja tunni 52 kokkuvõtte põhjal.",
      "Planeerimismärkused nimetavad viis vaheaega, ei kasuta trimestri- ega veerandijaotust ning jätavad ligikaudu kümme varutundi; need ei tõenda õppekava täielikkust.",
      "PDF-is leiduvate vanade välislinkide praegust kättesaadavust ega sisu ei kontrollitud.",
      "Lehekülg 17 sisaldab ainult leheküljenumbrit ning ei loonud õppekirjet.",
      "Kanooniliste Opiq-lehtede ja URL-idega vastendamine on teadlikult edasi lükatud."
    ]
  },
  "route_context": {
    "source_id": "grade-7-science",
    "md_path": "project-files/outputs/opiq_7klass_loodusopetus.md",
    "mapping_status": "deferred"
  },
  "annual_allocation": {
    "weekly_hours": 2,
    "declared_annual_hours": 70,
    "extracted_lesson_span": {
      "lesson_start": 1,
      "lesson_end": 70
    }
  },
  "general_learning_outcomes": {
    "source_pages": [
      1
    ],
    "values_and_attitudes": [
      "Õpilane tunneb huvi loodusteaduste õppimise ning loodusteadusliku ja tehnikaalase karjääri vastu.",
      "Õpilane väärtustab uurimistegevust ja loovust loodusnähtuste tundmaõppimisel.",
      "Õpilane usub oma võimetesse ja tegutseb loodusnähtusi uurides enesekindlalt.",
      "Õpilane järgib katsetamisel kokkuleppeid ning hoiab korda ja katsevahendeid.",
      "Õpilane väärtustab elusa ja eluta looduse mitmekesisust."
    ],
    "inquiry_skills": [
      "Õpilane vaatleb ja esitab loodusteaduslikke küsimusi.",
      "Õpilane sõnastab katse või vaatlusega kontrollitava uurimisküsimuse või hüpoteesi.",
      "Õpilane kavandab ja viib koostöös läbi uurimuse või katse.",
      "Õpilane eristab mõõdetavaid ja mittemõõdetavaid muutujaid.",
      "Õpilane eristab lihtsas katses sõltumatut ja sõltuvat muutujat.",
      "Õpilane hindab andmete usaldusväärsust ning kordus- ja kontrollkatsete vajadust.",
      "Õpilane esitab tulemusi tabelite ja diagrammidena.",
      "Õpilane leiab seoseid graafiliselt ja mittegraafiliselt esitatud andmetes.",
      "Õpilane teeb andmetest järeldusi, ennustab tulemusi ja hindab hüpoteesi.",
      "Õpilane esitab uurimistulemusi suuliselt, kirjalikult ja visuaalselt.",
      "Õpilane rakendab loodusteaduslike probleemide lahendamisel matemaatikat.",
      "Õpilane järgib katsejuhendeid ja ohutusnõudeid.",
      "Õpilane põhjendab loodusteaduslike teadmiste vajalikkust igapäevaelus."
    ]
  },
  "thematic_blocks": [
    {
      "block_id": "inimene-uurib-loodust",
      "title_et": "INIMENE UURIB LOODUST",
      "normalized_summary_et": "Loodusteaduslikku uurimist, mõõtmist, mõõtemääramatust ja andmete graafilist esitamist rakendatakse praktiliste mõõtmis- ja kaardistamisülesannete kaudu.",
      "source_pages": [
        2,
        3,
        4,
        5,
        6
      ],
      "derived_hours": {
        "minimum": 19,
        "maximum": 19,
        "basis": "numbered_lesson_span",
        "source_text": "lessons 1-19"
      },
      "main_numbered_lesson_span": {
        "lesson_start": 1,
        "lesson_end": 19
      },
      "teaching_goals": [
        "Arendada teadusliku ja mitteteadusliku info eristamist.",
        "Õpetada mõõteriistade kasutamist ja usaldusväärsete mõõtmistulemuste hindamist.",
        "Rakendada uurimuse etappe, muutujaid ja graafilist andmeesitust."
      ],
      "learning_outcomes": [
        "Õpilane mõistab loodusteaduste ja tehnoloogia tähtsust.",
        "Õpilane kirjeldab kehade omadusi kvalitatiivselt ja kvantitatiivselt.",
        "Õpilane mõõdab pikkust, pindala, ruumala ja massi ning seostab uue varasemate teadmistega."
      ],
      "learning_content": [
        "Loodusteadused ja tehnoloogia.",
        "Teaduslik meetod, vaatlus ja katse.",
        "Mõõteriistad, mõõteühikud ja mõõtmistulemuste usaldusväärsus.",
        "Andmete graafiline esitamine."
      ],
      "key_concepts": [
        "mõõtmine",
        "mõõtühik",
        "mõõteriist",
        "füüsikaline suurus",
        "pikkus",
        "pindala",
        "ruumala",
        "mass"
      ],
      "practical_work": [
        "Mõõteriistade kasutamine.",
        "Kehade pikkuse, pindala, ruumala ja massi mõõtmine.",
        "Objekti mõõdistamine ja plaani koostamine.",
        "Muutujate seose uurimine graafikul."
      ],
      "ict_activities": [
        "Digitaalsete mõõteriistade, veebiallikate ja graafikute kasutamine."
      ],
      "assessment": [
        "Mõõtmisoskuse, ühikute teisendamise, töö vormistamise ja uurimistulemuste esitamise hindamine."
      ],
      "cross_curricular_links": [
        "matemaatika",
        "geograafia",
        "ajalugu",
        "ühiskonnaõpetus",
        "eesti keel",
        "kehaline kasvatus"
      ],
      "transversal_themes": [
        "elukestev õpe ja karjääri planeerimine",
        "teabekeskkond",
        "tehnoloogia ja innovatsioon",
        "tervis ja ohutus",
        "ühiskonna jätkusuutlik areng",
        "kultuuriline identiteet"
      ],
      "equipment_and_materials": [
        "mõõteriistad",
        "kaalud",
        "termomeetrid",
        "mõõtesilinder",
        "ülevooluanum",
        "mõõdulint"
      ],
      "external_links": [
        "novaator.ee",
        "loodusajakiri.ee",
        "ilmateenistus.ee",
        "http://www.globe.ee/doc/GLOBE_atmosfaar_2.PDF",
        "http://opetaja.edu.ee/hindamismudelid/index.php",
        "http://www.kalkulaator.ee/?lang=1&page=12",
        "http://www.sisekaitse.ee/?id=28068"
      ],
      "extraction_confidence": "high",
      "unresolved_fields": [
        "unnumbered-wrap-up-row",
        "lesson-14-missing-topic-cell",
        "cross-page-table-continuations",
        "previous-grade-prerequisite-references"
      ]
    },
    {
      "block_id": "ainete-ja-kehade-mitmekesisus",
      "title_et": "AINETE JA KEHADE MITMEKESISUS",
      "normalized_summary_et": "Ainete ehitust, olekuid, tihedust, puhtaid aineid, segusid ja lahuseid uuritakse mudelite, mõõtmiste ning segude eraldamise kaudu.",
      "source_pages": [
        6,
        7,
        8,
        9,
        10
      ],
      "derived_hours": {
        "minimum": 15,
        "maximum": 15,
        "basis": "numbered_lesson_span",
        "source_text": "lessons 20-34"
      },
      "main_numbered_lesson_span": {
        "lesson_start": 20,
        "lesson_end": 34
      },
      "teaching_goals": [
        "Selgitada ainete osakestest koosnemist ja mudelite kasutamist.",
        "Õpetada aine omaduste, tiheduse, lahuste ja segude uurimist.",
        "Harjutada sobivate segude eraldamise meetodite valimist."
      ],
      "learning_outcomes": [
        "Õpilane eristab aatomit, molekuli, lihtainet ja liitainet.",
        "Õpilane valmistab lahuse ja lahutab segu sobiva meetodiga.",
        "Õpilane eristab aineid omaduste järgi ja kasutab nähtuse selgitamiseks mudelit."
      ],
      "learning_content": [
        "Aatom, molekul, rakk ja keemiline element.",
        "Aine olekud ja tihedus.",
        "Puhtad ained, segud, materjalid ja lahused."
      ],
      "key_concepts": [
        "aatom",
        "molekul",
        "keemiline element",
        "lihtaine",
        "liitaine",
        "puhas aine",
        "segu",
        "lahus",
        "tihedus",
        "mudel"
      ],
      "practical_work": [
        "Molekulimudelite koostamine.",
        "Tiheduse määramine.",
        "Lahuse omaduste uurimine.",
        "Segu lahutamine ja kromatograafia."
      ],
      "ict_activities": [
        "Perioodilisuse tabelite, aine olekute simulatsioonide ja videote kasutamine."
      ],
      "assessment": [
        "Laboritöö oskuste, arvutuste, mudelite ja tööde kaitsmise hindamine."
      ],
      "cross_curricular_links": [
        "keemia",
        "füüsika",
        "bioloogia",
        "matemaatika",
        "geograafia",
        "inimeseõpetus",
        "kunstiõpetus"
      ],
      "transversal_themes": [
        "teabekeskkond",
        "tervis ja ohutus",